nombre,descripcion,precio,stock,categoria
Notebook Lenovo IdeaPad,Notebook para uso general y trabajo,599990,10,Electrónica
Smartphone Samsung Galaxy A54,Teléfono móvil gama media,399990,25,Electrónica
Audífonos Bluetooth JBL,Audífonos inalámbricos con micrófono,49990,50,Audio
Silla Gamer RGB,Silla ergonómica para gaming,129990,15,Muebles
Teclado Mecánico Redragon,Teclado mecánico retroiluminado,34990,40,Periféricos
Mouse Logitech G203,Mouse gamer de alta precisión,19990,60,Periféricos
Monitor LG 24 pulgadas,Monitor Full HD IPS,119990,20,Electrónica
Hervidor Eléctrico 1.7L,Hervidor automático de agua,15990,35,Electrodomésticos
